index,Price_x,Image,Partial_url,Ratings,complete url,Product Title_y,Available Offers,Highlights,Specifications,Rating & Reviews
6,"₹8,499",https://rukminim1.flixcart.com/image/312/312/xif0q/mobile/w/d/o/-original-imaghgbyhy6banxv.jpeg?q=70,/samsung-galaxy-f04-opal-green-64-gb/p/itmd0c05f8b03876?pid=MOBGKY2V7QZ2QVFS&lid=LSTMOBGKY2V7QZ2QVFSGOGYVU&marketplace=FLIPKART&q=mobiles&store=tyy%2F4io&spotlightTagId=BestsellerId_tyy%2F4io&srno=s_1_7&otracker=search&otracker1=search&iid=be907a08-c9a1-477e-8d0d-2a49e5c68944.MOBGKY2V7QZ2QVFS.SEARCH&ssid=la65o6zomo0000001684022739158&qH=eb4af0bf07c16429,4.3,https://www.flipkart.com/samsung-galaxy-f04-opal-green-64-gb/p/itmd0c05f8b03876?pid=MOBGKY2V7QZ2QVFS&lid=LSTMOBGKY2V7QZ2QVFSGOGYVU&marketplace=FLIPKART&q=mobiles&store=tyy%2F4io&spotlightTagId=BestsellerId_tyy%2F4io&srno=s_1_7&otracker=search&otracker1=search&iid=be907a08-c9a1-477e-8d0d-2a49e5c68944.MOBGKY2V7QZ2QVFS.SEARCH&ssid=la65o6zomo0000001684022739158&qH=eb4af0bf07c16429,"SAMSUNG Galaxy F04 (Opal Green, 64 GB)  (4 GB RAM)",Bank OfferGet 10% Cashback on Samsung Axis bank Credit CardT&CBank Offer5% Cashback on Flipkart Axis Bank CardT&CSpecial PriceGet extra ₹3000 off (price inclusive of cashback/coupon)T&CFreebieGet 200% Welcome Bonus upto ₹10000*T&CView 4 more offers,Highlights4 GB RAM | 64 GB ROM | Expandable Upto 1 TB16.51 cm (6.5 inch) HD Display13MP + 2MP | 5MP Front Camera5000 mAh Lithium-Ion BatteryMediatek Helio P35 Processor,"SpecificationsGeneralIn The BoxHandset, USB Cable, Adaptor, Ejection Pin, ManualModel NumberSM-E045FZGGINSModel NameGalaxy F04ColorOpal GreenBrowse TypeSmartphonesSIM TypeDual SimHybrid Sim SlotNoTouchscreenYesOTG CompatibleYesDisplay FeaturesDisplay Size16.51 cm (6.5 inch)Resolution1600 x 720 PixelsResolution TypeHDGPUImagination GE8320Display TypeHD LCD DisplayHD Game SupportYesOther Display FeaturesHD+ LCD In-Cell Touch DisplayOs & Processor FeaturesOperating SystemAndroid 12Processor TypeMediatek Helio P35Primary Clock Speed2.3 GHzSecondary Clock Speed1.8 GHzOperating Frequency2G GSM: 850/900/1800 MHz, 3G UMTS(WCDMA): B1/B5/B8, 4G LTE FDD: B1/B3/B5/B7/B8/B20/B28, 4G LTE TDD: B38/B40/B41Memory & Storage FeaturesInternal Storage64 GBRAM4 GBTotal Memory64 GBExpandable Storage1 TBSupported Memory Card TypeMicroSDCamera FeaturesPrimary Camera AvailableYesPrimary Camera13MP + 2MPPrimary Camera FeaturesDual Camera Setup: 13 MP Main Camera(f/2.2 Aperture) + 2 MP Camera, Auto Focus, Camera Feature: Food, Hyperlapse, Panorama, Photo, Portrait, Pro, VideoOptical ZoomYesSecondary Camera AvailableYesSecondary Camera5MP Front CameraSecondary Camera Features5 MP Camera Setup: (f/2.2 Aperture)FlashYesHD RecordingYesVideo RecordingYesDigital ZoomUpto 10x ZoomFrame Rate30 fpsDual Camera LensPrimary CameraCall FeaturesCall Wait/HoldYesVideo Call SupportYesCall DivertYesCall TimerYesSpeaker PhoneYesCall RecordsYesLogsYesConnectivity FeaturesNetwork Type4G, 3G, 2GSupported NetworksGSM, CDMA, 4G LTE3G Speed5.76 MbpsBluetooth SupportYesBluetooth Versionv5.0Wi-FiYesWi-Fi Version802.11Wi-Fi HotspotYesMini HDMI PortNoNFCNoUSB TetheringYesUSB ConnectivityYesAudio JackType CMap SupportGoogle MapsGPS SupportYesOther DetailsSmartphoneYesSIM SizeNano SimSocial Networking PhoneYesInstant MessageYesBusiness PhoneNoRemovable BatteryNoMMSYesSMSYesVoice InputYesGraphics PPI269 PPIPredictive Text InputYesSeriesF SeriesBrowserGoogle ChromeMultimedia FeaturesFM RadioYesFM Radio RecordingYesDLNA SupportNoAudio FormatsMP3, M4A, 3GA, AAC, OGG, OGA, WAV, AMR, AWB, FLAC, MID, MIDI, XMF, MXMF, IMY, RTTTL, RTX, OTAMusic PlayerYesVideo FormatsMP4, M4V, 3GP, 3G2, AVI, FLV, MKV, WEBMBattery & Power FeaturesBattery Capacity5000 mAhDual BatteryNoDimensionsWidth75.9 mmHeight164.2 mmDepth9.1 mmWeight188 gWarrantyWarranty Summary1 Year Manufacturer Warranty for Device and 6 Months Manufacturer Warranty for In-Box AccessoriesCovered in WarrantyManufacturing DefectRead More","Ratings & ReviewsRate Product4.3★14,340 Ratings &680 Reviews5★4★3★2★1★9,1792,7151,0193931,0343.3Camera3.8Battery3.9Display3.9Design+ 675Terrific purchaseF04 is a very basic Android phone and will easily suit anyone with normal usage like call, texts, UPI, normal tasks. Gamers shouldn't consider this phone. The battery lasts more than a day. Got Android 13 update. UI is very friendly and easy to use with lots of handy features and shortcuts. Overall a descent budget Android phone.READ MORECertified Buyer, Karur1 month ago3914PermalinkReport Abuse3NiceBattery is 5volt and 1.55 amps so that charging time is up to 4 .00 hrs, this is only 7.5 watts charger  please don't  encourage  this productREAD MORER.SOWMIYANARAYANANCertified Buyer, Coimbatore3 months ago10719PermalinkReport Abuse4Very GoodOverall good smartphoneREAD MOREIrfan ShaikhCertified Buyer, Mumbai3 months ago403109PermalinkReport Abuse5Best in the market!Very good 😊👍READ MOREKhadanpara RakeshCertified Buyer, Bagasara3 months ago560159PermalinkReport Abuse5WonderfulThank You So Much FlipkartREAD MORECertified Buyer, Kolhapur District1 month ago388PermalinkReport Abuse5Terrific purchaseExcellent phone made in India morethen 5 start ratingREAD MOREVanaja ModemCertified Buyer, Warangal Urban1 month ago13543PermalinkReport Abuse3Just okayMOBILE ok but camera not goodREAD MORESUNDER GANGWERCertified Buyer, Bareilly3 months ago13043PermalinkReport Abuse1Waste of money!Product looks good but the case is of low quality. Display is blur and phone gets heated very fast. Not really fast while scrolling and lags.READ MOREShoiab KhanCertified Buyer, Bengaluru3 months ago7221PermalinkReport Abuse5Terrific purchasePerformance super this product is worthREAD MORECertified Buyer, Sipcot Perundurai1 month ago309PermalinkReport Abuse2Bad qualityPhone is OK...Been using it for the third day, no gaming but the battery drains quickly. Too quickly for a new phone.READ MOREDr Shahzeb AnsariCertified Buyer, Bhiwandi3 months ago70PermalinkReport Abuse+All 680 reviews"
7,"₹10,999",https://rukminim1.flixcart.com/image/312/312/xif0q/mobile/a/i/v/-original-imagfhu6bdzhnmkz.jpeg?q=70,/samsung-galaxy-f13-nightsky-green-64-gb/p/itmeadfda1bd23fa?pid=MOBGENJWF4KJTPEN&lid=LSTMOBGENJWF4KJTPENS2XJXA&marketplace=FLIPKART&q=mobiles&store=tyy%2F4io&srno=s_1_8&otracker=search&otracker1=search&iid=be907a08-c9a1-477e-8d0d-2a49e5c68944.MOBGENJWF4KJTPEN.SEARCH&ssid=la65o6zomo0000001684022739158&qH=eb4af0bf07c16429,4.4,https://www.flipkart.com/samsung-galaxy-f13-nightsky-green-64-gb/p/itmeadfda1bd23fa?pid=MOBGENJWF4KJTPEN&lid=LSTMOBGENJWF4KJTPENS2XJXA&marketplace=FLIPKART&q=mobiles&store=tyy%2F4io&srno=s_1_8&otracker=search&otracker1=search&iid=be907a08-c9a1-477e-8d0d-2a49e5c68944.MOBGENJWF4KJTPEN.SEARCH&ssid=la65o6zomo0000001684022739158&qH=eb4af0bf07c16429,"SAMSUNG Galaxy F13 (Nightsky Green, 64 GB)  (4 GB RAM)",Bank OfferGet 10% Cashback on Samsung Axis bank Credit CardT&CBank Offer5% Cashback on Flipkart Axis Bank CardT&CSpecial PriceGet extra ₹4000 off (price inclusive of cashback/coupon)T&CFreebieGet 200% Welcome Bonus upto ₹10000*T&CView 4 more offers,Highlights4 GB RAM | 64 GB ROM | Expandable Upto 1 TB16.76 cm (6.6 inch) Full HD+ Display50MP + 5MP + 2MP | 8MP Front Camera6000 mAh Lithium Ion BatteryExynos 850 Processor,"SpecificationsGeneralIn The BoxHandset, Travel Adapter, Data Cable (A to C), Ejection Pin, Quick Start GuideModel NumberSM-E135FZGDINSModel NameGalaxy F13ColorNightsky GreenBrowse TypeSmartphonesSIM TypeDual SimHybrid Sim SlotNoTouchscreenYesOTG CompatibleYesDisplay FeaturesDisplay Size16.76 cm (6.6 inch)Resolution2408 x 1080 PixelsResolution TypeFull HD+GPUARM Mali G52Display TypeFull HD+HD Game SupportYesDisplay Colors16MOther Display Features6.6"" FHD+ DewdropOs & Processor FeaturesOperating SystemAndroid 12Processor TypeExynos 850Processor CoreOcta CorePrimary Clock Speed2 GHzOperating Frequency2G GSM: 850/900/1800/1900, 3G UMTS(WCDMA): B1(2100)/B5(850)/B8(900), 4G LTE FDD: B1(2100)/B3(1800)/B5(850)/B7(2600)/B8(900)/B20(800)/B28(700), 4G LTE TDD: B38(2600)/B40(2300)/B41(2500)Memory & Storage FeaturesInternal Storage64 GBRAM4 GBExpandable Storage1 TBSupported Memory Card TypeMIcroSDMemory Card Slot TypeDedicated SlotCall Log MemoryYesCamera FeaturesPrimary Camera AvailableYesPrimary Camera50MP + 5MP + 2MPPrimary Camera FeaturesTriple Camera Setup: 50MP + 5MP + 2MP, Camera Features: Deco Pic, Food, Macro, Panorama, Photo, Portrait, Pro, VideoOptical ZoomYesSecondary Camera AvailableYesSecondary Camera8MP Front CameraSecondary Camera Features8MP Camera SetupFlashRear FlashHD RecordingYesFull HD RecordingYesVideo RecordingYesDigital Zoom10XFrame Rate30 fpsImage EditorYesDual Camera LensPrimary CameraCall FeaturesCall Wait/HoldYesHands FreeYesVideo Call SupportYesCall DivertYesPhone BookYesCall TimerYesSpeaker PhoneYesSpeed DialingYesCall RecordsYesLogsYesConnectivity FeaturesNetwork Type4G, 3G, 2GSupported Networks4G LTE, WCDMA, GSMInternet Connectivity4G, 3G, Wi-Fi, GPRS3G Speed5.76 MbpsGPRSYesPre-installed BrowserGoogle Chrome, Samsung S Browser 14.0Bluetooth SupportYesBluetooth Versionv5.0Wi-FiYesWi-Fi Version802.11 a/b/g/n/ac (2.4 GHz | 5 GHz)Wi-Fi HotspotYesMini HDMI PortNoNFCYesUSB TetheringYesTV OutNoInfraredNoUSB ConnectivityYesAudio Jack3.5mmMap SupportYesGPS SupportYesOther DetailsSmartphoneYesSIM SizeNano SimSocial Networking PhoneYesInstant MessageYesRemovable BatteryNoMMSYesSMSYesKeypadNoVoice InputYesGraphics PPI401 PPIPredictive Text InputYesSensorsAccelerometer, Fingerprint Sensor, Geomagnetic Sensor, Virtual Light Sensing, Virtual Proximity SensingSeriesF SeriesBrowserGoogle Chrome, Samsung S Browser 14.0Ringtones FormatMP3, M4A, 3GA, AAC, OGG, OGA, WAV, WMA, AMR, AWB, FLAC, MID, MIDI, XMF, MXMF, IMY, RTTTL, RTX, OTAMultimedia FeaturesFM RadioYesFM Radio RecordingYesDLNA SupportNoAudio FormatsAMR, M4AVideo FormatsMP4, 3GPBattery & Power FeaturesBattery Capacity6000 mAhDual BatteryNoDimensionsWidth76.9 mmHeight165.4 mmDepth9.3 mmWeight207 gWarrantyWarranty Summary1 Year Warranty Provided By the Manufacturer from Date of PurchaseCovered in WarrantyManufacturing DefectDomestic Warranty1 YearRead More","Ratings & ReviewsRate Product4.4★1,42,705 Ratings &8,205 Reviews5★4★3★2★1★92,66627,80410,1303,8808,2253.7Camera4.2Battery4.0Display4.0Design+ 7844Good quality productI like this product almost all aspects I'm giving my reviews after 7 day Expecially battery it amazing 50 to 20 % drop =6 hours Charging time 2 hour's 15 minutes And also display good performance also OK daily usesCamera OKREAD MOREcharan  rajCertified Buyer, Jogipet6 months ago2624416PermalinkReport Abuse5Just wow!Truly speaking it is a budget smartphone at this price range. Camera quality is pretty good 👍. Performance in awesome, as well as the battery 🔋 life is much more satisfactory. Display quality is very good.Build quality also much attractive👌.Thank you 😊READ MORENilmoni  PalCertified Buyer, Bengaluru6 months ago1664273PermalinkReport Abuse5Must buy!I used to one week this phone battery backup super and camera so good so this price. thank you Flipkart Samsung and seller.😃😃😃READ MOREJayanta MahatoCertified Buyer, Chennai6 months ago3227659PermalinkReport Abuse5TerrificMobile is fine and satisfied for all but i think also add screen gard ( Glass ) and Back cover in box than is better for on this price . 👍👌😊READ MOREFlipkart CustomerCertified Buyer, Surat7 months ago2137472PermalinkReport Abuse5ExcellentGood phone for the priceDisplay is averageCamera is good backFront average Battery okBack plastic frame average feelPerformance is good for the price Only buy this as a daily driver and don't expect heavy gaming overall a good phone for good price. final verdict: good phone for its priceREAD MOREBollam Sai Bharath PatelCertified Buyer, Huzurabad7 months ago2491559PermalinkReport Abuse5ExcellentVery fast delivery battery backup is good camera quality is also good and within this range we can't get much better than thisREAD MOREFlipkart CustomerCertified Buyer, Guwahati7 months ago1167260PermalinkReport Abuse5Highly recommendedMobile is fine and satisfied for all but  I think also add screen gard and back cover in box  then is better for on this price. Overly good product 👍👍😊READ MORESuresh  MaliCertified Buyer, Sangli District5 months ago11923PermalinkReport Abuse3FairThis mobile is purely for normal use, I don't recommend this for heavy users. Camera is ok. The battery is really working good and long lasting. Samsung could have given a  better processor. I will recommend to choose other mobile in this price range according to processor. Otherwise everything is ok ok.READ MOREAloka SahuCertified Buyer, Ganjam District10 months ago2191684PermalinkReport Abuse5Must buy!Delivery person VIJAY KUMAR is very Nice his behaviour too Good. Given review after using the phone, super camera 📷 quality, very nice performance and design. Overall VERY NICE phone in this price segment. Go for it. Thank you Flipkart. 😀READ MOREPinki DeviCertified Buyer, Patna6 months ago18555PermalinkReport Abuse4Nice productI am using this Phone since last 7 days , Feel like Very good Handset . In this price segment it is best .READ MOREAmlendu  KarnCertified Buyer, Pune9 months ago813318PermalinkReport Abuse+All 8205 reviews"
8,"₹7,749",https://rukminim1.flixcart.com/image/312/312/xif0q/mobile/6/v/0/c51-mzb0dxkin-poco-original-imagzdpycgrcdc8z.jpeg?q=70,/poco-c51-royal-blue-64-gb/p/itm1e4e8373537a7?pid=MOBGZCQFCWNDK89P&lid=LSTMOBGZCQFCWNDK89PTMGT86&marketplace=FLIPKART&q=mobiles&store=tyy%2F4io&srno=s_1_9&otracker=search&otracker1=search&iid=be907a08-c9a1-477e-8d0d-2a49e5c68944.MOBGZCQFCWNDK89P.SEARCH&ssid=la65o6zomo0000001684022739158&qH=eb4af0bf07c16429,4.4,https://www.flipkart.com/poco-c51-royal-blue-64-gb/p/itm1e4e8373537a7?pid=MOBGZCQFCWNDK89P&lid=LSTMOBGZCQFCWNDK89PTMGT86&marketplace=FLIPKART&q=mobiles&store=tyy%2F4io&srno=s_1_9&otracker=search&otracker1=search&iid=be907a08-c9a1-477e-8d0d-2a49e5c68944.MOBGZCQFCWNDK89P.SEARCH&ssid=la65o6zomo0000001684022739158&qH=eb4af0bf07c16429,"POCO C51 (Royal Blue, 64 GB)  (4 GB RAM)","Bank Offer10% off on Kotak Credit Card EMI Transactions, up to ₹1,000, on orders of ₹5,000 and aboveT&CBank OfferFlat ₹750 Instant Discount on HDFC Bank Credit Card EMI Txn on orders between Rs12,000 to Rs14,999T&CBank Offer10% off on IndusInd Bank Credit Card EMI Transactions, up to ₹1,000 on orders of ₹7,500 and aboveT&CFreebieGet 200% Welcome Bonus upto ₹10000*T&CView 5 more offers",Highlights4 GB RAM | 64 GB ROM | Expandable Upto 1 TB16.56 cm (6.52 inch) HD+ Display8MP Rear Camera | 5MP Front Camera5000 mAh BatteryHelio G36 Processor,"SpecificationsGeneralIn The BoxHandset, 10W Adapter, USB Cable, Sim Eject Tool, Quick Start Guide, Warranty CardModel NumberMZB0DXKINModel NameC51ColorRoyal BlueBrowse TypeSmartphonesSIM TypeDual SimHybrid Sim SlotNoTouchscreenYesOTG CompatibleYesQuick ChargingYesSAR ValueSAR Limit: 1.6 W/kg, Head: 0.966 W/kg, Body: 0.873 W/kgDisplay FeaturesDisplay Size16.56 cm (6.52 inch)Resolution1600 x 720 PixelsResolution TypeHD+GPUIMG PowerVRDisplay TypeHD+ Scratch Resistant DisplayOther Display Features120Hz Touch Sampling Rate, Brightness: 400nitsOs & Processor FeaturesOperating SystemAndroid 13Processor TypeHelio G36Processor CoreOcta CorePrimary Clock Speed2.2 GHzOperating Frequency2G GSM: B2/B3/B5/B8, 3G WCDMA: B1/B5/B8, 4G LTE TDD: B40/B41, 4G LTE FDD: B1/B3/B5/B8Memory & Storage FeaturesInternal Storage64 GBRAM4 GBExpandable Storage1 TBSupported Memory Card TypeMicroSDMemory Card Slot TypeDedicated SlotCall Log MemoryYesCamera FeaturesPrimary Camera AvailableYesPrimary Camera8MP Rear CameraPrimary Camera Features8MP AI Dual Camera: (f/2.0 Aperture), Camera Features: HDR Mode, Photo Mode, Video Mode, Portrait Mode, Short Video, Timelapse, Tilt-Shift ModeSecondary Camera AvailableYesSecondary Camera5MP Front CameraSecondary Camera Features5MP Front CameraFlashRear FlashHD RecordingYesFull HD RecordingYesVideo RecordingYesVideo Recording ResolutionRear Camera: 1080p (at 30 fps), 720p (at 30 fps) | Front Camera: 1080p (at 30 fps), 720p (at 30 fps)Digital ZoomYesFrame Rate60 HzDual Camera LensPrimary CameraCall FeaturesCall Wait/HoldYesConference CallYesHands FreeYesCall DivertYesPhone BookYesCall TimerYesSpeaker PhoneYesCall RecordsYesConnectivity FeaturesNetwork Type2G, 3G, 4G, 4G VOLTESupported Networks4G LTE, 4G VoLTE, GSM, WCDMAInternet Connectivity4G, 3G, Wi-Fi, EDGE, GPRS3GYesGPRSYesMicro USB PortYesBluetooth SupportYesBluetooth Versionv5.0Wi-FiYesWi-Fi Version802.11 b/g/nWi-Fi HotspotYesMini HDMI PortNoNFCNoUSB TetheringYesUSB ConnectivityYesEDGEYesAudio Jack3.5mmMap SupportGoogle MapsGPS SupportYesOther DetailsSmartphoneYesTouchscreen TypeCapacitiveSIM SizeNano SimUser InterfaceAndroid 13 (Go Edition)Instant MessageYesRemovable BatteryNoMMSYesSMSYesKeypadNoVoice InputYesPredictive Text InputYesSensorsAccelerometer, Fingerprint SensorBrowserGoogle ChromeOther FeaturesSplash Resistant Coating, MIUI Dialer, Upto 3 GB Turbo RAMGPS TypeGPS, AGPS, GLONASS, BEIDOUMultimedia FeaturesFM RadioYesFM Radio RecordingYesBattery & Power FeaturesBattery Capacity5000 mAhBattery TypeLithium PolymerDimensionsWidth76.75 mmHeight164.9 mmDepth9.09 mmWeight192 gWarrantyWarranty Summary1 Year Manufacturer Warranty for Phone and 6 Months Warranty for in the Box AccessoriesDomestic Warranty1 YearRead More","Ratings & ReviewsRate Product4.4★4,747 Ratings &125 Reviews5★4★3★2★1★3,3646843081282633.6Camera4.0Battery3.9Display3.8Design+ 115Classy productFor this price, the phone is good, not for gaming. But you use simple gameREAD MORECertified Buyer, Patna12 days ago11412PermalinkReport Abuse4Nice productCamera nicely see 😁🤗🤠READ MORECertified Buyer, Kalpi14 days ago20127PermalinkReport Abuse5Simply awesomeJustify with the price Good mobile for basic usage display and back is averageREAD MORECertified Buyer, Khandwa20 days ago19728PermalinkReport Abuse5Great productGoodREAD MORECertified Buyer, Murshidabad District10 days ago477PermalinkReport Abuse1Waste of money!Processor is slowREAD MORECertified Buyer, Deoria1 month ago12227PermalinkReport Abuse2Expected a better productCharging time mobile is hot . Automatically mobile switch off . Not goodREAD MORECertified Buyer, Masat South Twenty Four Parganas District29 days ago5610PermalinkReport Abuse1Very poorOne of worst product i have ever buyREAD MORECertified Buyer, Prayagraj29 days ago8419PermalinkReport Abuse5Fabulous!GoodREAD MORECertified Buyer, Jamkhandi1 month ago4815PermalinkReport Abuse2Slightly disappointedOverheating ProblemREAD MORECertified Buyer, Chapra4 days ago132PermalinkReport Abuse1Useless productHang from first dayREAD MORECertified Buyer, Baharagora27 days ago164PermalinkReport Abuse+All 125 reviews"
9,"₹6,499",https://rukminim1.flixcart.com/image/312/312/xif0q/mobile/t/a/x/-original-imaghmtch6qfmfxg.jpeg?q=70,/poco-c50-royal-blue-32-gb/p/itma43af9d14952e?pid=MOBGK8WZUTGDEZFA&lid=LSTMOBGK8WZUTGDEZFAWKBDLT&marketplace=FLIPKART&q=mobiles&store=tyy%2F4io&srno=s_1_10&otracker=search&otracker1=search&iid=be907a08-c9a1-477e-8d0d-2a49e5c68944.MOBGK8WZUTGDEZFA.SEARCH&ssid=la65o6zomo0000001684022739158&qH=eb4af0bf07c16429,4.3,https://www.flipkart.com/poco-c50-royal-blue-32-gb/p/itma43af9d14952e?pid=MOBGK8WZUTGDEZFA&lid=LSTMOBGK8WZUTGDEZFAWKBDLT&marketplace=FLIPKART&q=mobiles&store=tyy%2F4io&srno=s_1_10&otracker=search&otracker1=search&iid=be907a08-c9a1-477e-8d0d-2a49e5c68944.MOBGK8WZUTGDEZFA.SEARCH&ssid=la65o6zomo0000001684022739158&qH=eb4af0bf07c16429,"POCO C50 (Royal Blue, 32 GB)  (2 GB RAM)","Bank Offer10% off on Kotak Credit Card EMI Transactions, up to ₹1,000, on orders of ₹5,000 and aboveT&CBank OfferFlat ₹750 Instant Discount on HDFC Bank Credit Card EMI Txn on orders between Rs12,000 to Rs14,999T&CBank Offer10% off on IndusInd Bank Credit Card EMI Transactions, up to ₹1,000 on orders of ₹7,500 and aboveT&CSpecial PriceGet extra ₹2500 off (price inclusive of cashback/coupon)T&CView 7 more offers","Highlights2 GB RAM | 32 GB ROM | Expandable Upto 512 GB16.56 cm (6.52 inch) HD+ Display8MP Dual Camera | 5MP Front Camera5000 mAh Lithium Polymer BatteryMediatek Helio A22 Processor, Upto 2.0 GHz Processor","SpecificationsGeneralIn The BoxHandset, 10W Travel Adapter, USB Cable, Sim Eject Tool, Quick Start Guide, Warranty CardModel NumberMZB0D3DIN|MZB0D3CINModel NameC50ColorRoyal BlueBrowse TypeSmartphonesSIM TypeDual SimHybrid Sim SlotNoTouchscreenYesOTG CompatibleYesQuick ChargingYesSAR ValueSAR Limit: 1.6 W/kg, Head: 0.869 W/kg, Body: 0.838 W/kgDisplay FeaturesDisplay Size16.56 cm (6.52 inch)Resolution1600 x 720 PixelsResolution TypeHD+GPUIMG PowerVRDisplay TypeHD+ Scratch Resistant DisplayOther Display Features120 Hz Touch Sampling Rate, Brightness: 400 nitsOs & Processor FeaturesOperating SystemAndroid 12 GoProcessor TypeMediatek Helio A22 Processor, Upto 2.0 GHzPrimary Clock Speed2 GHzSecondary Clock Speed2 GHzTertiary Clock Speed2 GHzOperating Frequency2G GSM: B2/B3/B5/B8, 3G WCDMA: B1/B5/B8, 4G LTE TDD: B40/B41, 4G LTE FDD: B1/B3/B5/B8Memory & Storage FeaturesInternal Storage32 GBRAM2 GBExpandable Storage512 GBSupported Memory Card TypeMicroSDMemory Card Slot TypeDedicated SlotCall Log MemoryYesCamera FeaturesPrimary Camera AvailableYesPrimary Camera8MP Dual CameraPrimary Camera Features8 MP AI Dual Camera: f/2.0 Aperture, Camera Feature: Photo Mode, Video Mode, Portrait Mode, Short Video, Timelapse, Tilt Shift ModeSecondary Camera AvailableYesSecondary Camera5MP Front CameraSecondary Camera Features5 MP Camera SetupFlashRear FlashHD RecordingYesFull HD RecordingYesVideo RecordingYesVideo Recording ResolutionRear Camera: 1080p (at 30 fps), 720p (at 30 fps) | Front Camera: 1080p (at 30 fps), 720p (at 30 fps)Digital ZoomYesFrame Rate30 fpsDual Camera LensPrimary CameraCall FeaturesCall Wait/HoldYesHands FreeYesCall DivertYesPhone BookYesCall TimerYesSpeaker PhoneYesCall RecordsYesConnectivity FeaturesNetwork Type4G VOLTE, 4G, 3G, 2GSupported Networks4G VoLTE, 4G LTE, WCDMA, GSMInternet Connectivity4G, 3G, Wi-Fi, EDGE, GPRSGPRSYesMicro USB PortYesBluetooth SupportYesBluetooth Versionv5.0Wi-FiYesWi-Fi Version802.11/b/g/nWi-Fi HotspotYesMini HDMI PortNoNFCNoUSB TetheringYesUSB ConnectivityYesAudio Jack3.5mmMap SupportGoogle mapsGPS SupportYesOther DetailsSmartphoneYesTouchscreen TypeCapacitiveSIM SizeNano SimUser InterfaceAndroid 12 (Go edition)Instant MessageYesMMSYesSMSYesKeypadNoVoice InputYesPredictive Text InputYesSensorsAccelerometer, Rear Fingerprint SensorBrowserGoogle ChromeOther FeaturesScratch Resistant Display, 3.5mm Jack, Dedicated Micro SD Slot, Splash Proof Coating, 10W Fast Charging PowerGPS TypeGPS, AGPS, GLONASS, BEIDOUMultimedia FeaturesFM RadioYesFM Radio RecordingYesBattery & Power FeaturesBattery Capacity5000 mAhDimensionsWidth76.45 mmHeight164.9 mmDepth9.09 mmWeight192 gWarrantyWarranty Summary1 Year Manufacturer Warranty for Phone and 6 Months Warranty for In the Box AccessoriesDomestic Warranty1 YearRead More","Ratings & ReviewsRate Product4.3★23,030 Ratings &1,014 Reviews5★4★3★2★1★14,7323,9321,7848101,7723.3Camera3.9Battery3.7Display3.9Design+ 1075Classy productInitial impressions:- First up all at this price range it's really good value for money products 👌  I purchased it for my mom so she doesn't know much about android phone so not big expectations from her end regarding performance and etc... Thats why it' may be a decent choice .Pros* 1- Camera is decent 2- 5000 MAH Battery also good3- Display is decent 4- Sound quality is also good5- Look and design realy impressive. 6- processor is decent 7- stock android go edition with MIUI ...READ MORESumit SolankiCertified Buyer, Dehradun2 months ago609129PermalinkReport Abuse5Must buy!Phone is Best Value for money phone from poco THANKS To Flipkart I Purchased For my dad and my dad is satisfied 🤩 Great Features 5000mah battery backup is awesomeREAD MORECertified Buyer, Kolkata1 month ago11733PermalinkReport Abuse3Does the jobVery good in look and design is very goodREAD MORERohan KumarCertified Buyer, Korba1 month ago531PermalinkReport Abuse5Classy productVery good product ❤️👍READ MOREParimal MondalCertified Buyer, Berhampore2 months ago659103PermalinkReport Abuse4Pretty goodGood product with good price...although front camera is ok while back camera is good..battery life is super.READ MOREFlipkart CustomerCertified Buyer, Paratwada3 months ago674105PermalinkReport Abuse5WonderfulSuperREAD MOREFlipkart CustomerCertified Buyer, Koch Bihar District3 months ago11314PermalinkReport Abuse5Terrificfor only who have limited budget... running smoothly for your daily life routine work ...🎈READ MOREChirag SolankiCertified Buyer, Ahmedabad3 months ago25644PermalinkReport Abuse5Terrific purchaseGood product 👍READ MOREJibrail  AlamCertified Buyer, Purba Champaran District1 month ago762149PermalinkReport Abuse4Pretty goodIts good in this price rage...... stock andriod experience...❤️READ MORESubham SingCertified Buyer, Puruliya District2 months ago6910PermalinkReport Abuse5Fabulous!Nice phoneREAD MORECertified Buyer, Lohardaga17 days ago120PermalinkReport Abuse+All 1014 reviews"
