index,Price_x,Image,Partial_url,Ratings,complete url,Product Title_y,Available Offers,Highlights,Specifications,Rating & Reviews
14,"₹7,999",https://rukminim1.flixcart.com/image/312/312/xif0q/mobile/b/y/g/-original-imagnfzybft7wzmp.jpeg?q=70,/poco-c55-power-black-64-gb/p/itme567bcd596fe9?pid=MOBGMXSW9PHJVQCA&lid=LSTMOBGMXSW9PHJVQCAFSO8NV&marketplace=FLIPKART&q=mobiles&store=tyy%2F4io&srno=s_1_15&otracker=search&otracker1=search&iid=be907a08-c9a1-477e-8d0d-2a49e5c68944.MOBGMXSW9PHJVQCA.SEARCH&ssid=la65o6zomo0000001684022739158&qH=eb4af0bf07c16429,4.2,https://www.flipkart.com/poco-c55-power-black-64-gb/p/itme567bcd596fe9?pid=MOBGMXSW9PHJVQCA&lid=LSTMOBGMXSW9PHJVQCAFSO8NV&marketplace=FLIPKART&q=mobiles&store=tyy%2F4io&srno=s_1_15&otracker=search&otracker1=search&iid=be907a08-c9a1-477e-8d0d-2a49e5c68944.MOBGMXSW9PHJVQCA.SEARCH&ssid=la65o6zomo0000001684022739158&qH=eb4af0bf07c16429,"POCO C55 (Power Black, 64 GB)  (4 GB RAM)","Bank Offer10% off on Kotak Credit Card EMI Transactions, up to ₹1,000, on orders of ₹5,000 and aboveT&CBank OfferFlat ₹750 Instant Discount on HDFC Bank Credit Card EMI Txn on orders between Rs12,000 to Rs14,999T&CBank Offer10% off on IndusInd Bank Credit Card EMI Transactions, up to ₹1,000 on orders of ₹7,500 and aboveT&CSpecial PriceGet extra ₹4000 off (price inclusive of cashback/coupon)T&CView 6 more offers",Highlights4 GB RAM | 64 GB ROM | Expandable Upto 1 TB17.04 cm (6.71 inch) HD+ Display50MP Rear Camera | 5MP Front Camera5000 mAh BatteryMediatek Helio G85 Processor,"SpecificationsGeneralIn The BoxHandset, 10W Charger, Micro USB Cable, Sim Eject Tool, Quick Start Guide, Warranty CardModel NumberMZB0DDLINModel NameC55ColorPower BlackBrowse TypeSmartphonesSIM TypeDual SimHybrid Sim SlotNoTouchscreenYesOTG CompatibleYesQuick ChargingYesSAR ValueSAR Limit: 1.6 W/kg, Head SAR: 0.868 W/kg, Body SAR: 0.769 W/kgDisplay FeaturesDisplay Size17.04 cm (6.71 inch)Resolution1650 x 720 PixelsResolution TypeHD+GPUArm Mali-G52 MC2 (at 1 GHz)Other Display FeaturesTouch Sampling Rate: 120HzOs & Processor FeaturesOperating SystemAndroid 12Processor TypeMediatek Helio G85Processor CoreOcta CorePrimary Clock Speed2 GHzSecondary Clock Speed1.8 GHzOperating Frequency2G GSM: B2/B3/B5/B8, 3G WCDMA: B1/B5/B8, 4G LTE TDD: B40/B41, 4G LTE FDD: B1/B3/B5/B8Memory & Storage FeaturesInternal Storage64 GBRAM4 GBExpandable Storage1 TBSupported Memory Card TypeMicroSDMemory Card Slot TypeDedicated SlotCall Log MemoryYesCamera FeaturesPrimary Camera AvailableYesPrimary Camera50MP Rear CameraPrimary Camera FeaturesAI Dual Camera Setup: 50MP (f/1.8 Aperture, 1.28um (4-in-1 Super Pixel)), Camera Features: Photo Mode, 50MP Mode, Timelapse, Night Mode, Portrait Mode, Document Mode, Movie Frame, Voice Shutter, Tilt Shift, Timed BurstSecondary Camera AvailableYesSecondary Camera5MP Front CameraSecondary Camera Features5MP Front Camera: Camera Features: Portrait Mode, HDR, Front Video Recording, Palm Shutter, Voice Shutter, Movie Frame, TimelapseFlashRear FlashHD RecordingYesFull HD RecordingYesVideo RecordingYesVideo Recording ResolutionRear Camera: 1080p (at 30 fps), 720p (at 30 fps) | Front Camera: 1080p (at 30 fps), 720p (at 30 fps)Digital Zoom10XFrame Rate30 fpsImage EditorYesCall FeaturesCall Wait/HoldYesConference CallYesHands FreeYesCall DivertYesPhone BookYesCall TimerYesSpeaker PhoneYesCall RecordsYesConnectivity FeaturesNetwork Type4G VOLTE, 4G, 3G, 2GSupported Networks4G VoLTE, 4G LTE, WCDMA, GSMInternet Connectivity4G, 3G, Wi-Fi, EDGE, GPRS3GYesGPRSYesMicro USB PortYesBluetooth SupportYesBluetooth Versionv5.0Wi-FiYesWi-Fi VersionSupports 2.4 GHz and 5 GHz Dual BandWi-Fi HotspotYesMini HDMI PortNoNFCNoUSB TetheringYesInfraredNoUSB ConnectivityYesAudio Jack3.5mmMap SupportYesGPS SupportYesOther DetailsSmartphoneYesSIM SizeNano SimUser InterfaceMIUI 13 (Based on Android 12)Removable BatteryNoMMSYesSMSYesKeypadNoVoice InputYesPredictive Text InputYesUser Memory47.3SensorsAccelerometer, Rear Fingerprint Sensor, Light Sensor (Software Solution), Proximity Sensor (Software Solution)BrowserGoogle ChromeOther FeaturesLeather-Stitch Design, Scratch Resistant Display with Oleophobic Coating, IP52 Protection, 3 GB Turbo RAMGPS TypeGPS, AGPS, GLONASS, GALILEO, QZSSMultimedia FeaturesFM RadioYesFM Radio RecordingNoMusic PlayerYesBattery & Power FeaturesBattery Capacity5000 mAhBattery TypeLithium PolymerDimensionsWidth76.41 mmHeight168.76 mmDepth8.77 mmWeight192 gWarrantyWarranty Summary1 Year Manufacturer Warranty for Phone and 6 Months Warranty for In the Box AccessoriesDomestic Warranty1 YearRead More","Ratings & ReviewsRate Product4.2★13,204 Ratings &674 Reviews5★4★3★2★1★7,9412,6981,0863891,0903.4Camera3.9Battery3.7Display3.9Design+ 1204Worth the moneyDecent camera. (In day light)Good processor. (Normal user)Display was very good Battery backup also very good.They should give the Refresh rate atleast 90htzGood design i love green colour 💚READ MOREFlipkart CustomerCertified Buyer, Palghar2 months ago57584PermalinkReport Abuse5Perfect product!It is a very good product at this price segment.I am very happy to have it . Thank you Flipkart for this amazing deal.READ MOREBijay GharamiCertified Buyer, Burdwan Division2 months ago45485PermalinkReport Abuse5Worth every pennyBest phone best quality nice product camera display is the best 👍READ MORERitik  ChouhanCertified Buyer, Sehore District2 months ago559PermalinkReport Abuse4Really NiceBest phone for this price point I am happy design is one of the best leather stitch looks like its wallet.READ MORETanveer AhmadCertified Buyer, Srinagar2 months ago01PermalinkReport Abuse5Highly recommendedNice Phone.🥰🥰READ MORERatan SinghCertified Buyer, Prayagraj2 months ago68148PermalinkReport Abuse3NiceGood product...READ MOREPranabesh PramanikCertified Buyer, Kaliaganj2 months ago887PermalinkReport Abuse4Good choiceAverage phone in price..👍READ MOREAditya KantCertified Buyer, Maunath Bhanjan2 months ago9710PermalinkReport Abuse5Fabulous!Very nice phoneREAD MOREToyab SekhCertified Buyer, Harirampur2 months ago18928PermalinkReport Abuse5AwesomeI gifted my wife she really liked this mobileREAD MOREFlipkart CustomerCertified Buyer, Barpeta2 months ago20841PermalinkReport Abuse5Must buy!Superb mobile..READ MOREFlipkart CustomerCertified Buyer, Jagtial District1 month ago120PermalinkReport Abuse+All 674 reviews"
15,"₹9,499",https://rukminim1.flixcart.com/image/312/312/xif0q/mobile/y/9/g/-original-imagnfzyhh8gz8sd.jpeg?q=70,/poco-c55-cool-blue-128-gb/p/itm26aca9fd143ba?pid=MOBGMXSWJHRVUWFE&lid=LSTMOBGMXSWJHRVUWFEKXH4XM&marketplace=FLIPKART&q=mobiles&store=tyy%2F4io&srno=s_1_16&otracker=search&otracker1=search&iid=be907a08-c9a1-477e-8d0d-2a49e5c68944.MOBGMXSWJHRVUWFE.SEARCH&ssid=la65o6zomo0000001684022739158&qH=eb4af0bf07c16429,4.2,https://www.flipkart.com/poco-c55-cool-blue-128-gb/p/itm26aca9fd143ba?pid=MOBGMXSWJHRVUWFE&lid=LSTMOBGMXSWJHRVUWFEKXH4XM&marketplace=FLIPKART&q=mobiles&store=tyy%2F4io&srno=s_1_16&otracker=search&otracker1=search&iid=be907a08-c9a1-477e-8d0d-2a49e5c68944.MOBGMXSWJHRVUWFE.SEARCH&ssid=la65o6zomo0000001684022739158&qH=eb4af0bf07c16429,"POCO C55 (Cool Blue, 128 GB)  (6 GB RAM)","Bank Offer10% off on Kotak Credit Card EMI Transactions, up to ₹1,000, on orders of ₹5,000 and aboveT&CBank OfferFlat ₹750 Instant Discount on HDFC Bank Credit Card EMI Txn on orders between Rs12,000 to Rs14,999T&CBank Offer10% off on IndusInd Bank Credit Card EMI Transactions, up to ₹1,000 on orders of ₹7,500 and aboveT&CSpecial PriceGet extra ₹4500 off (price inclusive of cashback/coupon)T&CView 6 more offers",Highlights6 GB RAM | 128 GB ROM | Expandable Upto 1 TB17.04 cm (6.71 inch) HD+ Display50MP Rear Camera | 5MP Front Camera5000 mAh BatteryMediatek Helio G85 Processor,"SpecificationsGeneralIn The BoxHandset, 10W Charger, Micro USB Cable, Sim Eject Tool, Quick Start Guide, Warranty CardModel NumberMZB0DDTINModel NameC55ColorCool BlueBrowse TypeSmartphonesSIM TypeDual SimHybrid Sim SlotNoTouchscreenYesOTG CompatibleYesQuick ChargingYesSAR ValueSAR Limit: 1.6 W/kg, Head SAR: 0.868 W/kg, Body SAR: 0.769 W/kgDisplay FeaturesDisplay Size17.04 cm (6.71 inch)Resolution1650 x 720 PixelsResolution TypeHD+GPUArm Mali-G52 MC2 (at 1 GHz)Other Display FeaturesTouch Sampling Rate: 120HzOs & Processor FeaturesOperating SystemAndroid 12Processor TypeMediatek Helio G85Processor CoreOcta CorePrimary Clock Speed2 GHzSecondary Clock Speed1.8 GHzOperating Frequency2G GSM: B2/B3/B5/B8, 3G WCDMA: B1/B5/B8, 4G LTE TDD: B40/B41, 4G LTE FDD: B1/B3/B5/B8Memory & Storage FeaturesInternal Storage128 GBRAM6 GBExpandable Storage1 TBSupported Memory Card TypeMicroSDMemory Card Slot TypeDedicated SlotCall Log MemoryYesCamera FeaturesPrimary Camera AvailableYesPrimary Camera50MP Rear CameraPrimary Camera FeaturesAI Dual Camera Setup: 50MP (f/1.8 Aperture, 1.28um (4-in-1 Super Pixel)), Camera Features: Photo Mode, 50MP Mode, Timelapse, Night Mode, Portrait Mode, Document Mode, Movie Frame, Voice Shutter, Tilt Shift, Timed BurstSecondary Camera AvailableYesSecondary Camera5MP Front CameraSecondary Camera Features5MP Front Camera: Camera Features: Portrait Mode, HDR, Front Video Recording, Palm Shutter, Voice Shutter, Movie Frame, TimelapseFlashRear FlashHD RecordingYesFull HD RecordingYesVideo RecordingYesVideo Recording ResolutionRear Camera: 1080p (at 30 fps), 720p (at 30 fps) | Front Camera: 1080p (at 30 fps), 720p (at 30 fps)Digital Zoom10XFrame Rate30 fpsImage EditorYesCall FeaturesCall Wait/HoldYesConference CallYesHands FreeYesCall DivertYesPhone BookYesCall TimerYesSpeaker PhoneYesCall RecordsYesConnectivity FeaturesNetwork Type4G VOLTE, 4G, 3G, 2GSupported Networks4G VoLTE, 4G LTE, WCDMA, GSMInternet Connectivity4G, 3G, Wi-Fi, EDGE, GPRS3GYesGPRSYesMicro USB PortYesBluetooth SupportYesBluetooth Versionv5.0Wi-FiYesWi-Fi VersionSupports 2.4 GHz and 5 GHz Dual BandWi-Fi HotspotYesMini HDMI PortNoNFCNoUSB TetheringYesInfraredNoUSB ConnectivityYesAudio Jack3.5mmMap SupportYesGPS SupportYesOther DetailsSmartphoneYesSIM SizeNano SimUser InterfaceMIUI 13 (Based on Android 12)Removable BatteryNoMMSYesSMSYesKeypadNoVoice InputYesPredictive Text InputYesUser Memory108.7SensorsAccelerometer, Rear Fingerprint Sensor, Light Sensor (Software Solution), Proximity Sensor (Software Solution)BrowserGoogle ChromeOther FeaturesLeather-Stitch Design, Scratch Resistant Display with Oleophobic Coating, IP52 Protection, 5 GB Turbo RAMGPS TypeGPS, AGPS, GLONASS, GALILEO, QZSSMultimedia FeaturesFM RadioYesFM Radio RecordingNoMusic PlayerYesBattery & Power FeaturesBattery Capacity5000 mAhBattery TypeLithium PolymerDimensionsWidth76.41 mmHeight168.76 mmDepth8.77 mmWeight192 gWarrantyWarranty Summary1 Year Manufacturer Warranty for Phone and 6 Months Warranty for In the Box AccessoriesDomestic Warranty1 YearRead More","Ratings & ReviewsRate Product4.2★8,031 Ratings &406 Reviews5★4★3★2★1★4,9051,4425762688403.3Camera3.7Battery3.6Display3.7Design+ 234Good choiceThe product is worth for the price we pay. Those who are looking for a phone for normal use without 5g i would say it's great deal. But dont expect best camera. But the phone has no lag so far. I had booked it the day they launched.READ MOREFlipkart CustomerCertified Buyer, Mangalore1 month ago10814PermalinkReport Abuse4Good quality productThe phone is good. But when you play heavy game there is heating problem. The charger also heat when you charge it. You can play free fire, BGMI, PUB-G and COD in a good graphics but it gets heat. The phone is too good in style.READ MOREAvyaCertified Buyer, Darbhanga2 months ago585118PermalinkReport Abuse5Mind-blowing purchaseMobile size lovable , good speed, battery also awesome,  overall good purchase for small budget use and great performanceREAD MOREFlipkart CustomerCertified Buyer, Secunderabad2 months ago20946PermalinkReport Abuse5Classy productVery good mobile.. better speed. awesome CAMERA.. worth for money .. i love this POCO C55READ MORECertified Buyer, Tirunelveli27 days ago251PermalinkReport Abuse5Classy productVery good product within small budget. I am fully satisfied with display touch and back camera. I recommend it to all my friends and family. In the poco brand almost all my family and friends purchased different Serieses like X3, M3, M2, M4pro, M3pro, now C55.READ MORECertified Buyer, Hyderabad27 days ago171PermalinkReport Abuse3FairCamera is not so good but at this price it is best. Performance is super you can play high games at medium. I will suggest if your budget is 10000 you should buy it. Very good phone 💗READ MORECertified Buyer, Rishra24 days ago204PermalinkReport Abuse5Mind-blowing purchaseGood product 👍🏻🥰READ MOREFlipkart CustomerCertified Buyer, Ghazipur2 months ago23120PermalinkReport Abuse5BrilliantEverything is gud only charging slow 🤗READ MOREArman AnsariCertified Buyer, Ramagundam2 months ago9511PermalinkReport Abuse5Must buy!NiceREAD MOREPankaj KumarCertified Buyer, Roorkee2 months ago17730PermalinkReport Abuse3Just okayPoco c55 average phone, processor is slow mediatek G85, battery 5000 mah good but charger is only 10 watts so taking lot of time to recharge  phone and  charger is heating up due to 10 watts charger used 18watt mi charger, very fast charging and no heat. Wifi speed is 25% lesser compared to other redmi mobile, display quality is average Miui dialer, sms and call recording is there a very plusGood design and finger print sensor on back panel very good, bought 6gb 128gb mobile. Speaker...READ MOREAlfonso Pereira Certified Buyer, Thiruvananthapuram2 months ago375PermalinkReport Abuse+All 406 reviews"
16,"₹9,499",https://rukminim1.flixcart.com/image/312/312/xif0q/mobile/b/y/g/-original-imagnfzybft7wzmp.jpeg?q=70,/poco-c55-power-black-128-gb/p/itm52dfc91751293?pid=MOBGMXSWPMRNGVGW&lid=LSTMOBGMXSWPMRNGVGWUDX773&marketplace=FLIPKART&q=mobiles&store=tyy%2F4io&srno=s_1_17&otracker=search&otracker1=search&iid=be907a08-c9a1-477e-8d0d-2a49e5c68944.MOBGMXSWPMRNGVGW.SEARCH&ssid=la65o6zomo0000001684022739158&qH=eb4af0bf07c16429,4.2,https://www.flipkart.com/poco-c55-power-black-128-gb/p/itm52dfc91751293?pid=MOBGMXSWPMRNGVGW&lid=LSTMOBGMXSWPMRNGVGWUDX773&marketplace=FLIPKART&q=mobiles&store=tyy%2F4io&srno=s_1_17&otracker=search&otracker1=search&iid=be907a08-c9a1-477e-8d0d-2a49e5c68944.MOBGMXSWPMRNGVGW.SEARCH&ssid=la65o6zomo0000001684022739158&qH=eb4af0bf07c16429,"POCO C55 (Power Black, 128 GB)  (6 GB RAM)","Bank Offer10% off on Kotak Credit Card EMI Transactions, up to ₹1,000, on orders of ₹5,000 and aboveT&CBank OfferFlat ₹750 Instant Discount on HDFC Bank Credit Card EMI Txn on orders between Rs12,000 to Rs14,999T&CBank Offer10% off on IndusInd Bank Credit Card EMI Transactions, up to ₹1,000 on orders of ₹7,500 and aboveT&CSpecial PriceGet extra ₹4500 off (price inclusive of cashback/coupon)T&CView 7 more offers",Highlights6 GB RAM | 128 GB ROM | Expandable Upto 1 TB17.04 cm (6.71 inch) HD+ Display50MP Rear Camera | 5MP Front Camera5000 mAh BatteryMediatek Helio G85 Processor,"SpecificationsGeneralIn The BoxHandset, 10W Charger, Micro USB Cable, Sim Eject Tool, Quick Start Guide, Warranty CardModel NumberMZB0DDKINModel NameC55ColorPower BlackBrowse TypeSmartphonesSIM TypeDual SimHybrid Sim SlotNoTouchscreenYesOTG CompatibleYesQuick ChargingYesSAR ValueSAR Limit: 1.6 W/kg, Head SAR: 0.868 W/kg, Body SAR: 0.769 W/kgDisplay FeaturesDisplay Size17.04 cm (6.71 inch)Resolution1650 x 720 PixelsResolution TypeHD+GPUArm Mali-G52 MC2 (at 1 GHz)Other Display FeaturesTouch Sampling Rate: 120HzOs & Processor FeaturesOperating SystemAndroid 12Processor TypeMediatek Helio G85Processor CoreOcta CorePrimary Clock Speed2 GHzSecondary Clock Speed1.8 GHzOperating Frequency2G GSM: B2/B3/B5/B8, 3G WCDMA: B1/B5/B8, 4G LTE TDD: B40/B41, 4G LTE FDD: B1/B3/B5/B8Memory & Storage FeaturesInternal Storage128 GBRAM6 GBExpandable Storage1 TBSupported Memory Card TypeMicroSDMemory Card Slot TypeDedicated SlotCall Log MemoryYesCamera FeaturesPrimary Camera AvailableYesPrimary Camera50MP Rear CameraPrimary Camera FeaturesAI Dual Camera Setup: 50MP (f/1.8 Aperture, 1.28um (4-in-1 Super Pixel)), Camera Features: Photo Mode, 50MP Mode, Timelapse, Night Mode, Portrait Mode, Document Mode, Movie Frame, Voice Shutter, Tilt Shift, Timed BurstSecondary Camera AvailableYesSecondary Camera5MP Front CameraSecondary Camera Features5MP Front Camera: Camera Features: Portrait Mode, HDR, Front Video Recording, Palm Shutter, Voice Shutter, Movie Frame, TimelapseFlashRear FlashHD RecordingYesFull HD RecordingYesVideo RecordingYesVideo Recording ResolutionRear Camera: 1080p (at 30 fps), 720p (at 30 fps) | Front Camera: 1080p (at 30 fps), 720p (at 30 fps)Digital Zoom10XFrame Rate30 fpsImage EditorYesCall FeaturesCall Wait/HoldYesConference CallYesHands FreeYesCall DivertYesPhone BookYesCall TimerYesSpeaker PhoneYesCall RecordsYesConnectivity FeaturesNetwork Type4G VOLTE, 4G, 3G, 2GSupported Networks4G VoLTE, 4G LTE, WCDMA, GSMInternet Connectivity4G, 3G, Wi-Fi, EDGE, GPRS3GYesGPRSYesMicro USB PortYesBluetooth SupportYesBluetooth Versionv5.0Wi-FiYesWi-Fi VersionSupports 2.4 GHz and 5 GHz Dual BandWi-Fi HotspotYesMini HDMI PortNoNFCNoUSB TetheringYesInfraredNoUSB ConnectivityYesAudio Jack3.5mmMap SupportYesGPS SupportYesOther DetailsSmartphoneYesSIM SizeNano SimUser InterfaceMIUI 13 (Based on Android 12)Removable BatteryNoMMSYesSMSYesKeypadNoVoice InputYesPredictive Text InputYesUser Memory108.7SensorsAccelerometer, Rear Fingerprint Sensor, Light Sensor (Software Solution), Proximity Sensor (Software Solution)BrowserGoogle ChromeOther FeaturesLeather-Stitch Design, Scratch Resistant Display with Oleophobic Coating, IP52 Protection, 5 GB Turbo RAMGPS TypeGPS, AGPS, GLONASS, GALILEO, QZSSMultimedia FeaturesFM RadioYesFM Radio RecordingNoMusic PlayerYesBattery & Power FeaturesBattery Capacity5000 mAhBattery TypeLithium PolymerDimensionsWidth76.41 mmHeight168.76 mmDepth8.77 mmWeight192 gWarrantyWarranty Summary1 Year Manufacturer Warranty for Phone and 6 Months Warranty for In the Box AccessoriesDomestic Warranty1 YearRead More","Ratings & ReviewsRate Product4.2★8,031 Ratings &406 Reviews5★4★3★2★1★4,9051,4425762688403.3Camera3.7Battery3.6Display3.7Design+ 234Good choiceThe product is worth for the price we pay. Those who are looking for a phone for normal use without 5g i would say it's great deal. But dont expect best camera. But the phone has no lag so far. I had booked it the day they launched.READ MOREFlipkart CustomerCertified Buyer, Mangalore1 month ago10814PermalinkReport Abuse4Good quality productThe phone is good. But when you play heavy game there is heating problem. The charger also heat when you charge it. You can play free fire, BGMI, PUB-G and COD in a good graphics but it gets heat. The phone is too good in style.READ MOREAvyaCertified Buyer, Darbhanga2 months ago585118PermalinkReport Abuse5Mind-blowing purchaseMobile size lovable , good speed, battery also awesome,  overall good purchase for small budget use and great performanceREAD MOREFlipkart CustomerCertified Buyer, Secunderabad2 months ago20946PermalinkReport Abuse5Classy productVery good mobile.. better speed. awesome CAMERA.. worth for money .. i love this POCO C55READ MORECertified Buyer, Tirunelveli27 days ago251PermalinkReport Abuse5Classy productVery good product within small budget. I am fully satisfied with display touch and back camera. I recommend it to all my friends and family. In the poco brand almost all my family and friends purchased different Serieses like X3, M3, M2, M4pro, M3pro, now C55.READ MORECertified Buyer, Hyderabad27 days ago171PermalinkReport Abuse3FairCamera is not so good but at this price it is best. Performance is super you can play high games at medium. I will suggest if your budget is 10000 you should buy it. Very good phone 💗READ MORECertified Buyer, Rishra24 days ago204PermalinkReport Abuse5Mind-blowing purchaseGood product 👍🏻🥰READ MOREFlipkart CustomerCertified Buyer, Ghazipur2 months ago23120PermalinkReport Abuse5BrilliantEverything is gud only charging slow 🤗READ MOREArman AnsariCertified Buyer, Ramagundam2 months ago9511PermalinkReport Abuse5Must buy!NiceREAD MOREPankaj KumarCertified Buyer, Roorkee2 months ago17730PermalinkReport Abuse3Just okayPoco c55 average phone, processor is slow mediatek G85, battery 5000 mah good but charger is only 10 watts so taking lot of time to recharge  phone and  charger is heating up due to 10 watts charger used 18watt mi charger, very fast charging and no heat. Wifi speed is 25% lesser compared to other redmi mobile, display quality is average Miui dialer, sms and call recording is there a very plusGood design and finger print sensor on back panel very good, bought 6gb 128gb mobile. Speaker...READ MOREAlfonso Pereira Certified Buyer, Thiruvananthapuram2 months ago375PermalinkReport Abuse+All 406 reviews"
